{
  "analysis_profile_version": null,
  "conditions": {},
  "corner_tire_age": {},
  "damage_repair": {},
  "data_quality": {},
  "field_pace": {},
  "garage61_representative_laps": {},
  "groove_evolution": {},
  "identity": {},
  "lap_traces": {},
  "laps": [],
  "pace_attribution": {},
  "race_grades": {},
  "race_investigation": {},
  "race_replay": {},
  "race_summary": {},
  "runs": [],
  "schema_version": 1,
  "setup_telemetry": {},
  "strategy": {},
  "strategy_planning": {},
  "technical_insights": [],
  "tire_learning": {},
  "track_geometry": {},
  "track_profile": {}
}
